대단원	중단원	소단원	상타	중타	하타	Chunk
Ⅲ.좌표평면과 그래프	좌표평면과 그래프	2 정비례와 반비례	1. 정비례 관계	⑴ 정비례	⑴ 정비례	⑴ 정비례: 두 변수 x, y에 대하여 x의 값이 2배, 3배, 4배, …로 변함에 따라 y의 값도 2배, 3배, 4배, …로 변하는 관계에 있을 때, y는 x에 정비례한다고 한다.
Ⅲ.좌표평면과 그래프	좌표평면과 그래프	2 정비례와 반비례	1. 정비례 관계	⑵ 정비례 관계식y가 x에 정비례하면 관계식은 y=ax(a+0) 꼴이다.	⑵ 정비례 관계식y가 x에 정비례하면 관계식은 y=ax(a+0) 꼴이다.	⑵ 정비례 관계식y가 x에 정비례하면 관계식은 y=ax(a+0) 꼴이다.
Ⅲ.좌표평면과 그래프	좌표평면과 그래프	2 정비례와 반비례	1. 정비례 관계	⑶ 정비례 관계의 그래프정비례 관계 y=ax(a+0)의 그래프는 원점을 지나는 직선이다.a>0일 때a<0일 때그래프yaO1xy1Oax그래프의 모양 오른쪽 위(↗)로 향하는 직선 오른쪽 아래(↘)로 향하는 직선지나는 사분면 제1사분면, 제3사분면제2사분면, 제4사분면각 사분면에서증가·감소 상태x의 값이 증가하면y의 값도 증가x의 값이 증가하면y의 값은 감소	⑶ 정비례 관계의 그래프정비례 관계 y=ax(a+0)의 그래프는 원점을 지나는 직선이다.a>0일 때a<0일 때그래프yaO1xy1Oax그래프의 모양 오른쪽 위(↗)로 향하는 직선 오른쪽 아래(↘)로 향하는 직선지나는 사분면 제1사분면, 제3사분면제2사분면, 제4사분면각 사분면에서증가·감소 상태x의 값이 증가하면y의 값도 증가x의 값이 증가하면y의 값은 감소	⑶ 정비례 관계의 그래프정비례 관계 y=ax(a+0)의 그래프는 원점을 지나는 직선이다.a>0일 때a<0일 때그래프yaO1xy1Oax그래프의 모양 오른쪽 위(↗)로 향하는 직선 오른쪽 아래(↘)로 향하는 직선지나는 사분면 제1사분면, 제3사분면제2사분면, 제4사분면각 사분면에서증가·감소 상태x의 값이 증가하면y의 값도 증가x의 값이 증가하면y의 값은 감소
Ⅲ.좌표평면과 그래프	좌표평면과 그래프	2 정비례와 반비례	2. 반비례 관계	⑴ 반비례	⑴ 반비례	⑴ 반비례: 두 변수 x, y에 대하여 x의 값이 2배, 3배, 4배, …로 변함에따라 y의 값은 ;2;! 배, ;3;! 배, ;4!;배, …로 변하는 관계에 있을 때, y는 x에반비례한다고 한다.
Ⅲ.좌표평면과 그래프	좌표평면과 그래프	2 정비례와 반비례	2. 반비례 관계	⑵ 반비례 관계식y가 x에 반비례하면 관계식은 y=;[;A (a+0) 꼴이다.	⑵ 반비례 관계식y가 x에 반비례하면 관계식은 y=;[;A (a+0) 꼴이다.	⑵ 반비례 관계식y가 x에 반비례하면 관계식은 y=;[;A (a+0) 꼴이다.
Ⅲ.좌표평면과 그래프	좌표평면과 그래프	2 정비례와 반비례	2. 반비례 관계	⑶ 반비례 관계의 그래프반비례 관계 y=;[A; (a+0)의 그래프는 원점에 대하여 대칭인 한 쌍의매끄러운 곡선이다.그래프a>0일 때yaO1xa<0일 때y1Oax지나는 사분면각 사분면에서증가·감소 상태제1사분면, 제3사분면x의 값이 증가하면y의 값은 감소제2사분면, 제4사분면x의 값이 증가하면y의 값도 증가y가 x에 정비례할 때,;[};(x+0)의 값은 항상 일정하다.y=ax에서 ;[};=a(일정)y가 x에 반비례할 때,xy의 값은 항상 일정하다.y=;[;A 에서 xy=a(일정)	⑶ 반비례 관계의 그래프반비례 관계 y=;[A; (a+0)의 그래프는 원점에 대하여 대칭인 한 쌍의매끄러운 곡선이다.그래프a>0일 때yaO1xa<0일 때y1Oax지나는 사분면각 사분면에서증가·감소 상태제1사분면, 제3사분면x의 값이 증가하면y의 값은 감소제2사분면, 제4사분면x의 값이 증가하면y의 값도 증가y가 x에 정비례할 때,;[};(x+0)의 값은 항상 일정하다.y=ax에서 ;[};=a(일정)y가 x에 반비례할 때,xy의 값은 항상 일정하다.y=;[;A 에서 xy=a(일정)	⑶ 반비례 관계의 그래프반비례 관계 y=;[A; (a+0)의 그래프는 원점에 대하여 대칭인 한 쌍의매끄러운 곡선이다.그래프a>0일 때yaO1xa<0일 때y1Oax지나는 사분면각 사분면에서증가·감소 상태제1사분면, 제3사분면x의 값이 증가하면y의 값은 감소제2사분면, 제4사분면x의 값이 증가하면y의 값도 증가y가 x에 정비례할 때,;[};(x+0)의 값은 항상 일정하다.y=ax에서 ;[};=a(일정)y가 x에 반비례할 때,xy의 값은 항상 일정하다.y=;[;A 에서 xy=a(일정)
