대단원	중단원	소단원	상타	중타	하타	Chunk
Ⅴ.평면도형과 입체도형	다면체와 회전체	2 회전체	1. 회전체	⑴ 회전체	⑴ 회전체	⑴ 회전체: 평면도형을 한 직선을 축으로 하여1회전 시킨 입체도형
Ⅴ.평면도형과 입체도형	다면체와 회전체	2 회전체	1. 회전체	⑵ 원뿔대	⑵ 원뿔대	⑵ 원뿔대: 원뿔을 밑면에 평행한 평면으로 잘라서생기는 두 입체도형 중에서 원뿔이 아닌 쪽의입체도형
Ⅴ.평면도형과 입체도형	다면체와 회전체	2 회전체	1. 회전체	⑶ 회전체의 종류회전체원기둥원뿔원뿔대ll겨냥도구l회전체	⑶ 회전체의 종류회전체원기둥원뿔원뿔대ll겨냥도구l회전체	⑶ 회전체의 종류회전체원기둥원뿔원뿔대ll겨냥도구l회전체
Ⅴ.평면도형과 입체도형	다면체와 회전체	2 회전체	1. 회전체	⑶ 회전체의 종류회전체원기둥원뿔원뿔대ll겨냥도구l회전체	① 회전축	① 회전축: 회전 시킬 때 축이 되는 직선
Ⅴ.평면도형과 입체도형	다면체와 회전체	2 회전체	1. 회전체	⑶ 회전체의 종류회전체원기둥원뿔원뿔대ll겨냥도구l회전체	② 모선	② 모선: 회전축의 옆면을 이루는 선분구는 회전축이 무수히 많고, 구의 옆면을 만드는 것은 곡선이므로 구에서는 모선을 생각하지않는다.
Ⅴ.평면도형과 입체도형	다면체와 회전체	2 회전체	2. 회전체의 성질	⑴ 회전체의 단면의 모양	⑴ 회전체의 단면의 모양	⑴ 회전체의 단면의 모양
Ⅴ.평면도형과 입체도형	다면체와 회전체	2 회전체	2. 회전체의 성질	⑴ 회전체의 단면의 모양	⑴ 회전체의 단면의 모양	① 회전체를 회전축에 수직인 평면으로 자르면 그 단면은 항상 원이다.
Ⅴ.평면도형과 입체도형	다면체와 회전체	2 회전체	2. 회전체의 성질	⑴ 회전체의 단면의 모양	⑴ 회전체의 단면의 모양	② 회전체를 회전축을 포함하는 평면으로 자르면 그 단면은 모두 합동이고, 회전축을 대칭축으로 하는 선대칭도형이다.회전체회전축에수직인평면으로자른 단면의모양회전축을포함하는평면으로자른 단면의모양원기둥l원l직사각형원뿔l원l이등변삼각형원뿔대l원l사다리꼴구l원l원
Ⅴ.평면도형과 입체도형	다면체와 회전체	2 회전체	2. 회전체의 성질	⑵ 회전체의 전개도회전체원기둥원뿔원뿔대전개도선대칭도형어떤 직선을 접는 선으로 하여접었을 때 완전히 겹쳐지는 도형을 선대칭도형이라 하고, 그직선을 대칭축이라고 한다.구는 전개도를 그릴 수 없다.	⑵ 회전체의 전개도회전체원기둥원뿔원뿔대전개도선대칭도형어떤 직선을 접는 선으로 하여접었을 때 완전히 겹쳐지는 도형을 선대칭도형이라 하고, 그직선을 대칭축이라고 한다.구는 전개도를 그릴 수 없다.	⑵ 회전체의 전개도회전체원기둥원뿔원뿔대전개도선대칭도형어떤 직선을 접는 선으로 하여접었을 때 완전히 겹쳐지는 도형을 선대칭도형이라 하고, 그직선을 대칭축이라고 한다.구는 전개도를 그릴 수 없다.
